{
  "$schema": "https://json-schema.org/draft/2020-12/schema",
  "$id": "urn:sspos:web-portal-api:v1:Department",
  "title": "Department",
  "description": "Payload of a Department row.",
  "type": "object",
  "properties": {
    "name": {
      "type": "string"
    },
    "position": {
      "type": [
        "string",
        "integer"
      ],
      "pattern": "^-?(?:0|[1-9]\\d*)$"
    },
    "colourHex": {
      "type": "string"
    },
    "isActive": {
      "type": "boolean"
    },
    "isVisibleOnTill": {
      "type": "boolean"
    },
    "showInReport": {
      "type": "boolean"
    },
    "defaultVatRateId": {
      "type": [
        "string",
        "null"
      ]
    },
    "id": {
      "type": "string"
    },
    "companyId": {
      "type": "string"
    },
    "createdAt": {
      "type": "string",
      "format": "date-time"
    },
    "updatedAt": {
      "type": "string",
      "format": "date-time"
    },
    "rowVersion": {
      "type": [
        "string",
        "integer"
      ],
      "pattern": "^-?(?:0|[1-9]\\d*)$"
    },
    "deletedAt": {
      "type": [
        "string",
        "null"
      ],
      "format": "date-time"
    },
    "isDeleted": {
      "type": "boolean"
    },
    "domainEvents": {
      "type": [
        "array",
        "null"
      ],
      "items": {
        "type": "object",
        "properties": {
          "eventId": {
            "type": [
              "string",
              "null"
            ]
          },
          "occurredAt": {
            "type": "string",
            "format": "date-time"
          },
          "version": {
            "type": [
              "string",
              "integer"
            ],
            "pattern": "^-?(?:0|[1-9]\\d*)$"
          }
        },
        "required": [
          "eventId",
          "occurredAt",
          "version"
        ]
      }
    }
  },
  "required": [
    "name",
    "position",
    "colourHex",
    "isActive",
    "isVisibleOnTill",
    "showInReport",
    "defaultVatRateId",
    "id",
    "companyId",
    "createdAt",
    "updatedAt",
    "rowVersion",
    "deletedAt",
    "isDeleted",
    "domainEvents"
  ]
}
